{
  "policyVersion": 1,
  "marker": "SYNTHETIC",
  "catalog": {
    "policyVersion": 1,
    "policyRevision": "synthetic.v1",
    "features": [
      {
        "id": "synthetic.sharedFree",
        "audience": "public",
        "implemented": true,
        "enabled": true,
        "supportedPlatforms": [
          "web",
          "macos",
          "iphone"
        ],
        "availableIn": [
          {
            "suite": "public",
            "channel": "stable",
            "platform": "web"
          },
          {
            "suite": "public",
            "channel": "stable",
            "platform": "macos"
          },
          {
            "suite": "public",
            "channel": "stable",
            "platform": "iphone"
          },
          {
            "suite": "public",
            "channel": "beta",
            "platform": "web"
          },
          {
            "suite": "public",
            "channel": "beta",
            "platform": "macos"
          },
          {
            "suite": "public",
            "channel": "beta",
            "platform": "iphone"
          },
          {
            "suite": "private",
            "channel": "experimental",
            "platform": "web"
          },
          {
            "suite": "private",
            "channel": "experimental",
            "platform": "macos"
          },
          {
            "suite": "private",
            "channel": "experimental",
            "platform": "iphone"
          }
        ],
        "minimumPublicTier": "free",
        "quota": null
      },
      {
        "id": "synthetic.sharedPremium",
        "audience": "public",
        "implemented": true,
        "enabled": true,
        "supportedPlatforms": [
          "web",
          "macos",
          "iphone"
        ],
        "availableIn": [
          {
            "suite": "public",
            "channel": "stable",
            "platform": "web"
          },
          {
            "suite": "public",
            "channel": "stable",
            "platform": "macos"
          },
          {
            "suite": "public",
            "channel": "stable",
            "platform": "iphone"
          },
          {
            "suite": "public",
            "channel": "beta",
            "platform": "web"
          },
          {
            "suite": "public",
            "channel": "beta",
            "platform": "macos"
          },
          {
            "suite": "public",
            "channel": "beta",
            "platform": "iphone"
          },
          {
            "suite": "private",
            "channel": "experimental",
            "platform": "web"
          },
          {
            "suite": "private",
            "channel": "experimental",
            "platform": "macos"
          },
          {
            "suite": "private",
            "channel": "experimental",
            "platform": "iphone"
          }
        ],
        "minimumPublicTier": "premium",
        "quota": null
      },
      {
        "id": "synthetic.privateExperiment",
        "audience": "private",
        "implemented": true,
        "enabled": true,
        "supportedPlatforms": [
          "web",
          "macos",
          "iphone"
        ],
        "availableIn": [
          {
            "suite": "private",
            "channel": "experimental",
            "platform": "web"
          },
          {
            "suite": "private",
            "channel": "experimental",
            "platform": "macos"
          },
          {
            "suite": "private",
            "channel": "experimental",
            "platform": "iphone"
          }
        ],
        "minimumPublicTier": "free",
        "quota": null
      },
      {
        "id": "synthetic.disabled",
        "audience": "public",
        "implemented": true,
        "enabled": false,
        "supportedPlatforms": [
          "web",
          "macos",
          "iphone"
        ],
        "availableIn": [
          {
            "suite": "public",
            "channel": "stable",
            "platform": "web"
          },
          {
            "suite": "public",
            "channel": "stable",
            "platform": "macos"
          },
          {
            "suite": "public",
            "channel": "stable",
            "platform": "iphone"
          },
          {
            "suite": "public",
            "channel": "beta",
            "platform": "web"
          },
          {
            "suite": "public",
            "channel": "beta",
            "platform": "macos"
          },
          {
            "suite": "public",
            "channel": "beta",
            "platform": "iphone"
          },
          {
            "suite": "private",
            "channel": "experimental",
            "platform": "web"
          },
          {
            "suite": "private",
            "channel": "experimental",
            "platform": "macos"
          },
          {
            "suite": "private",
            "channel": "experimental",
            "platform": "iphone"
          }
        ],
        "minimumPublicTier": "free",
        "quota": null
      },
      {
        "id": "synthetic.unimplemented",
        "audience": "public",
        "implemented": false,
        "enabled": true,
        "supportedPlatforms": [
          "web",
          "macos",
          "iphone"
        ],
        "availableIn": [
          {
            "suite": "public",
            "channel": "stable",
            "platform": "web"
          },
          {
            "suite": "public",
            "channel": "stable",
            "platform": "macos"
          },
          {
            "suite": "public",
            "channel": "stable",
            "platform": "iphone"
          },
          {
            "suite": "public",
            "channel": "beta",
            "platform": "web"
          },
          {
            "suite": "public",
            "channel": "beta",
            "platform": "macos"
          },
          {
            "suite": "public",
            "channel": "beta",
            "platform": "iphone"
          },
          {
            "suite": "private",
            "channel": "experimental",
            "platform": "web"
          },
          {
            "suite": "private",
            "channel": "experimental",
            "platform": "macos"
          },
          {
            "suite": "private",
            "channel": "experimental",
            "platform": "iphone"
          }
        ],
        "minimumPublicTier": "free",
        "quota": null
      },
      {
        "id": "synthetic.webOnly",
        "audience": "public",
        "implemented": true,
        "enabled": true,
        "supportedPlatforms": [
          "web"
        ],
        "availableIn": [
          {
            "suite": "public",
            "channel": "stable",
            "platform": "web"
          },
          {
            "suite": "public",
            "channel": "beta",
            "platform": "web"
          },
          {
            "suite": "private",
            "channel": "experimental",
            "platform": "web"
          }
        ],
        "minimumPublicTier": "free",
        "quota": null
      },
      {
        "id": "synthetic.betaOnly",
        "audience": "public",
        "implemented": true,
        "enabled": true,
        "supportedPlatforms": [
          "web",
          "macos",
          "iphone"
        ],
        "availableIn": [
          {
            "suite": "public",
            "channel": "beta",
            "platform": "web"
          },
          {
            "suite": "public",
            "channel": "beta",
            "platform": "macos"
          },
          {
            "suite": "public",
            "channel": "beta",
            "platform": "iphone"
          }
        ],
        "minimumPublicTier": "free",
        "quota": null
      },
      {
        "id": "synthetic.quotaTwo",
        "audience": "public",
        "implemented": true,
        "enabled": true,
        "supportedPlatforms": [
          "web",
          "macos",
          "iphone"
        ],
        "availableIn": [
          {
            "suite": "public",
            "channel": "stable",
            "platform": "web"
          },
          {
            "suite": "public",
            "channel": "stable",
            "platform": "macos"
          },
          {
            "suite": "public",
            "channel": "stable",
            "platform": "iphone"
          },
          {
            "suite": "public",
            "channel": "beta",
            "platform": "web"
          },
          {
            "suite": "public",
            "channel": "beta",
            "platform": "macos"
          },
          {
            "suite": "public",
            "channel": "beta",
            "platform": "iphone"
          },
          {
            "suite": "private",
            "channel": "experimental",
            "platform": "web"
          },
          {
            "suite": "private",
            "channel": "experimental",
            "platform": "macos"
          },
          {
            "suite": "private",
            "channel": "experimental",
            "platform": "iphone"
          }
        ],
        "minimumPublicTier": "free",
        "quota": {
          "free": 2,
          "premium": null
        }
      },
      {
        "id": "synthetic.zeroQuota",
        "audience": "public",
        "implemented": true,
        "enabled": true,
        "supportedPlatforms": [
          "web",
          "macos",
          "iphone"
        ],
        "availableIn": [
          {
            "suite": "public",
            "channel": "stable",
            "platform": "web"
          },
          {
            "suite": "public",
            "channel": "stable",
            "platform": "macos"
          },
          {
            "suite": "public",
            "channel": "stable",